{
  "$schema": "https://json-schema.org/draft/2020-12/schema",
  "$id": "https://shiftplan-converter.local/pack.schema.json",
  "title": "ShiftPlan employer pack",
  "description": "Packs are JSON-only: engines live in the app; packs select engines + supply match params and mappings.",
  "type": "object",
  "required": ["name", "groups"],
  "additionalProperties": false,
  "properties": {
    "$schema": { "type": "string" },
    "name": { "type": "string", "minLength": 1 },
    "hintKey": {
      "type": "string",
      "description": "i18n key for pack hint (UI). Never put German match targets here."
    },
    "preferredSourceId": { "type": "string" },
    "supportedSourceIds": {
      "type": "array",
      "items": { "type": "string" },
      "minItems": 1
    },
    "isSmokeDefault": {
      "type": "boolean",
      "description": "Exactly one builtin pack may be true — smoke/fixture default workplace."
    },
    "smokeWorkplace": {
      "type": "object",
      "additionalProperties": false,
      "required": ["groupId", "areaId", "preset"],
      "properties": {
        "groupId": { "type": "string" },
        "areaId": { "type": "string" },
        "preset": { "type": "string" }
      }
    },
    "groups": {
      "type": "array",
      "minItems": 1,
      "items": {
        "type": "object",
        "required": ["id", "label", "areas"],
        "additionalProperties": false,
        "properties": {
          "id": { "type": "string" },
          "label": { "type": "string" },
          "areas": {
            "type": "array",
            "minItems": 1,
            "items": {
              "oneOf": [
                {
                  "type": "object",
                  "required": ["id", "label", "mapping", "supported"],
                  "additionalProperties": false,
                  "properties": {
                    "id": { "type": "string" },
                    "label": {
                      "type": "string",
                      "description": "Fallback label; UI prefers mapping.department · mapping.role when set"
                    },
                    "mapping": {
                      "type": "string",
                      "description": "Relative path to role mapping JSON (dutyCodes, department, role, ocr, payroll)"
                    },
                    "supported": { "type": "boolean" }
                  }
                },
                {
                  "type": "object",
                  "required": ["expand"],
                  "additionalProperties": false,
                  "properties": {
                    "expand": {
                      "type": "object",
                      "required": ["id", "label", "from", "to", "mapping", "supported"],
                      "additionalProperties": false,
                      "description": "Expand station-{n} style series instead of listing each area",
                      "properties": {
                        "id": { "type": "string", "description": "Template with {n}" },
                        "label": { "type": "string", "description": "Template with {n}" },
                        "from": { "type": "integer" },
                        "to": { "type": "integer" },
                        "mapping": { "type": "string" },
                        "supported": { "type": "boolean" },
                        "overrides": {
                          "type": "object",
                          "additionalProperties": {
                            "type": "object",
                            "additionalProperties": false,
                            "properties": {
                              "id": { "type": "string" },
                              "label": { "type": "string" },
                              "mapping": { "type": "string" },
                              "supported": { "type": "boolean" }
                            }
                          }
                        }
                      }
                    }
                  }
                }
              ]
            }
          }
        }
      }
    }
  },
  "$defs": {
    "ocrScope": {
      "title": "OCR options for one pack group (or default)",
      "type": "object",
      "additionalProperties": false,
      "properties": {
        "preferredLayout": {
          "type": "string",
          "description": "auto or a concrete layout id from sources/ocr/layouts"
        },
        "layouts": {
          "type": "array",
          "items": { "type": "string" }
        },
        "usePackMapping": {
          "type": "boolean",
          "default": true
        },
        "showLayoutChips": {
          "type": "boolean"
        },
        "layoutPriors": {
          "type": "object",
          "additionalProperties": { "type": "number" }
        },
        "invertLightGlyphs": {
          "type": "boolean",
          "description": "Second OCR on luminance-inverted image; merge short light-on-dark cell glyphs (U/F/…). Not color→duty classification."
        },
        "dateDuty": {
          "type": "object",
          "description": "Pack vocabulary for OCR layout date-duty (dates × duty columns)",
          "additionalProperties": false,
          "required": ["columns"],
          "properties": {
            "boardMarkers": {
              "type": "array",
              "items": { "type": "string" }
            },
            "roleSuffixes": {
              "type": "array",
              "items": { "type": "string" }
            },
            "columns": {
              "type": "array",
              "items": {
                "type": "object",
                "additionalProperties": false,
                "required": ["id", "match"],
                "properties": {
                  "id": { "type": "string" },
                  "short": { "type": "string" },
                  "label": { "type": "string" },
                  "match": {
                    "type": "array",
                    "items": { "type": "string" },
                    "minItems": 1
                  },
                  "matchAll": { "type": "boolean" },
                  "times": {
                    "type": "array",
                    "description": "Duty hours by weekday/weekend (pack-authored)",
                    "items": {
                      "type": "object",
                      "additionalProperties": false,
                      "required": ["start", "end"],
                      "properties": {
                        "start": { "type": "string", "pattern": "^\\d{2}:\\d{2}$" },
                        "end": { "type": "string", "pattern": "^\\d{2}:\\d{2}$" },
                        "endNextDay": { "type": "boolean" },
                        "when": {
                          "type": "string",
                          "enum": [
                            "any",
                            "weekday",
                            "weekday-mon-thu",
                            "friday",
                            "weekend-or-holiday"
                          ]
                        }
                      }
                    }
                  }
                }
              }
            }
          }
        }
      }
    },
    "ocrConfig": {
      "title": "Pack OCR config (parsers/ocr.json)",
      "type": "object",
      "required": ["engine"],
      "additionalProperties": false,
      "properties": {
        "engine": {
          "type": "string",
          "const": "ocr-roster",
          "description": "App OCR engine id (convert/parsers/ocr/)"
        },
        "preferredLayout": {
          "type": "string",
          "description": "Legacy flat: auto or concrete layout id"
        },
        "layouts": {
          "type": "array",
          "items": { "type": "string" }
        },
        "usePackMapping": {
          "type": "boolean",
          "default": true
        },
        "invertLightGlyphs": {
          "type": "boolean",
          "description": "Second OCR on luminance-inverted image; merge short light-on-dark cell glyphs."
        },
        "dateDuty": { "$ref": "#/$defs/ocrScope/properties/dateDuty" },
        "default": { "$ref": "#/$defs/ocrScope" },
        "byGroup": {
          "type": "object",
          "additionalProperties": { "$ref": "#/$defs/ocrScope" },
          "description": "OCR options keyed by pack group id (pflege, arzt, …)"
        }
      }
    },
    "pdfConfig": {
      "title": "Pack PDF config (parsers/pdf.json)",
      "type": "object",
      "required": ["engine"],
      "additionalProperties": false,
      "properties": {
        "engine": {
          "type": "string",
          "enum": ["pdf-auto", "pdf-list", "pdf-timesheet", "pdf-payroll"],
          "description": "App PDF engine id (convert/parsers/engines/)"
        },
        "scoreHints": {
          "type": "array",
          "items": { "type": "string" },
          "description": "PDF match literals for auto scoring — not i18n"
        },
        "monthHeader": {
          "type": "object",
          "required": ["pattern"],
          "properties": {
            "pattern": { "type": "string" },
            "flags": { "type": "string" },
            "monthGroup": { "type": "integer", "minimum": 1 },
            "yearGroup": { "type": "integer", "minimum": 1 }
          }
        },
        "mainSectionRestart": { "type": "string" },
        "mainSectionRestartFlags": { "type": "string" },
        "onCallSection": { "type": "string" },
        "onCallSectionFlags": { "type": "string" },
        "shift": { "type": "object" },
        "allDay": { "type": "array", "items": { "type": "object" } },
        "onCall": { "type": "object" },
        "summary": { "type": "array", "items": { "type": "object" } }
      }
    }
  }
}
